Addresses,Animal Units,latitude,longitude
"W6920 Grogan Rd, Fort Atkinson, WI 53538",2300,42.856751,-88.877218
"9819 S Gustafson Rd, Clinton, WI 53525",2013,42.5343778,-88.9115881
"N9577 County Road F, Alma Center, WI 54611",1214,44.4166141,-90.9155646
"464 Canal Road, Marshall, WI 53559",1604,43.1883339,-89.0415197
"W7889 Reliance Road, Whitewater, WI 53190",860,42.80393,-88.686927
"W11819 Blanecae Rd, Randolph, WI 53956",2792,43.60985,-88.994787
"N3432 Cty BB, Columbus, WI 53925",1500,43.319185,-88.909296
"E10941 River Rd, Sauk City, WI 53583",1105,43.2619017,-89.7766429
